reports/gradcam/convnext_tiny/test/gradcam_metadata.csv

image_path,true_label,pred_label,confidence,correct,gradcam_path
/backup/Intern/combine_skindiseaseclassifier_devraj/data/splits/test/acne_vulgaris/dermassist__skin_diseases_kaggle__ec030cccba880951.jpeg,acne_vulgaris,acne_vulgaris,0.9999991655349731,True,/backup/Intern/combine_skindiseaseclassifier_devraj/reports/gradcam/convnext_tiny/test/acne_vulgaris__pred_acne_vulgaris__dermassist__skin_diseases_kaggle__ec030c.png
/backup/Intern/combine_skindiseaseclassifier_devraj/data/splits/test/acne_vulgaris/dermassist__skin_diseases_kaggle__c9c2ee82ba0a53cb.jpeg,acne_vulgaris,acne_vulgaris,0.9996931552886963,True,/backup/Intern/combine_skindiseaseclassifier_devraj/reports/gradcam/convnext_tiny/test/acne_vulgaris__pred_acne_vulgaris__dermassist__skin_diseases_kaggle__c9c2ee.png
/backup/Intern/combine_skindiseaseclassifier_devraj/data/splits/test/acne_vulgaris/dermassist__skin_diseases_kaggle__fc624a0f74ea0221.jpeg,acne_vulgaris,acne_vulgaris,0.9999998807907104,True,/backup/Intern/combine_skindiseaseclassifier_devraj/reports/gradcam/convnext_tiny/test/acne_vulgaris__pred_acne_vulgaris__dermassist__skin_diseases_kaggle__fc624a.png
/backup/Intern/combine_skindiseaseclassifier_devraj/data/splits/test/atopic_dermatitis/devraj__selected_900plus_final__967cb48b20a9c1ac.jpeg,atopic_dermatitis,atopic_dermatitis,0.7964617013931274,True,/backup/Intern/combine_skindiseaseclassifier_devraj/reports/gradcam/convnext_tiny/test/atopic_dermatitis__pred_atopic_dermatitis__devraj__selected_900plus_final__967cb48b.png
/backup/Intern/combine_skindiseaseclassifier_devraj/data/splits/test/atopic_dermatitis/devraj__selected_900plus_final__bdadc624160d1d4d.jpeg,atopic_dermatitis,atopic_dermatitis,0.9515631794929504,True,/backup/Intern/combine_skindiseaseclassifier_devraj/reports/gradcam/convnext_tiny/test/atopic_dermatitis__pred_atopic_dermatitis__devraj__selected_900plus_final__bdadc624.png
/backup/Intern/combine_skindiseaseclassifier_devraj/data/splits/test/atopic_dermatitis/dermassist__dermnet__3b47f68d5f6e0565.jpg,atopic_dermatitis,contact_dermatitis,0.9758197069168091,False,/backup/Intern/combine_skindiseaseclassifier_devraj/reports/gradcam/convnext_tiny/test/atopic_dermatitis__pred_contact_dermatitis__dermassist__dermnet__3b47f68d5f6e0565.png
/backup/Intern/combine_skindiseaseclassifier_devraj/data/splits/test/basal_cell_carcinoma/dermassist__skin_diseases_image__9e96f2f4b8216b29.jpg,basal_cell_carcinoma,basal_cell_carcinoma,0.8726055026054382,True,/backup/Intern/combine_skindiseaseclassifier_devraj/reports/gradcam/convnext_tiny/test/basal_cell_carcinoma__pred_basal_cell_carcinoma__dermassist__skin_diseases_image__9e96f2f.png
/backup/Intern/combine_skindiseaseclassifier_devraj/data/splits/test/basal_cell_carcinoma/dermassist__bcn20000__c09804e64bb7c226.jpg,basal_cell_carcinoma,basal_cell_carcinoma,0.9959241151809692,True,/backup/Intern/combine_skindiseaseclassifier_devraj/reports/gradcam/convnext_tiny/test/basal_cell_carcinoma__pred_basal_cell_carcinoma__dermassist__bcn20000__c09804e64bb7c226.png
/backup/Intern/combine_skindiseaseclassifier_devraj/data/splits/test/basal_cell_carcinoma/dermassist__skin_diseases_image__eb7f6d2e6f4e0ba9.jpg,basal_cell_carcinoma,basal_cell_carcinoma,0.5514647364616394,True,/backup/Intern/combine_skindiseaseclassifier_devraj/reports/gradcam/convnext_tiny/test/basal_cell_carcinoma__pred_basal_cell_carcinoma__dermassist__skin_diseases_image__eb7f6d2.png
/backup/Intern/combine_skindiseaseclassifier_devraj/data/splits/test/contact_dermatitis/devraj__selected_900plus_final__fafabce6e0e3e8c0.jpg,contact_dermatitis,contact_dermatitis,0.9999904632568359,True,/backup/Intern/combine_skindiseaseclassifier_devraj/reports/gradcam/convnext_tiny/test/contact_dermatitis__pred_contact_dermatitis__devraj__selected_900plus_final__fafabce6.png
/backup/Intern/combine_skindiseaseclassifier_devraj/data/splits/test/contact_dermatitis/dermassist__dermnet__056f0739bbbaa961.jpg,contact_dermatitis,contact_dermatitis,0.3243938386440277,True,/backup/Intern/combine_skindiseaseclassifier_devraj/reports/gradcam/convnext_tiny/test/contact_dermatitis__pred_contact_dermatitis__dermassist__dermnet__056f0739bbbaa961.png
/backup/Intern/combine_skindiseaseclassifier_devraj/data/splits/test/contact_dermatitis/devraj__selected_900plus_final__0c823388aa7aa0bb.jpg,contact_dermatitis,contact_dermatitis,0.9994514584541321,True,/backup/Intern/combine_skindiseaseclassifier_devraj/reports/gradcam/convnext_tiny/test/contact_dermatitis__pred_contact_dermatitis__devraj__selected_900plus_final__0c823388.png
/backup/Intern/combine_skindiseaseclassifier_devraj/data/splits/test/drug_eruptions/dermassist__dermnet__eb8314833cb08557.jpg,drug_eruptions,plaque_psoriasis,0.7966883182525635,False,/backup/Intern/combine_skindiseaseclassifier_devraj/reports/gradcam/convnext_tiny/test/drug_eruptions__pred_plaque_psoriasis__dermassist__dermnet__eb8314833cb08557.png
/backup/Intern/combine_skindiseaseclassifier_devraj/data/splits/test/drug_eruptions/devraj__pacific_train__03f747588976a11c.jpeg,drug_eruptions,tinea_corporis,0.8795382380485535,False,/backup/Intern/combine_skindiseaseclassifier_devraj/reports/gradcam/convnext_tiny/test/drug_eruptions__pred_tinea_corporis__devraj__pacific_train__03f747588976a11c.png
/backup/Intern/combine_skindiseaseclassifier_devraj/data/splits/test/drug_eruptions/devraj__pacific_test__5aff42a4730e1fe3.jpeg,drug_eruptions,drug_eruptions,0.9999322891235352,True,/backup/Intern/combine_skindiseaseclassifier_devraj/reports/gradcam/convnext_tiny/test/drug_eruptions__pred_drug_eruptions__devraj__pacific_test__5aff42a4730e1fe3.png
/backup/Intern/combine_skindiseaseclassifier_devraj/data/splits/test/folliculitis/devraj__selected_900plus_final__f3aab988bed1d2c2.jpg,folliculitis,folliculitis,0.9998841285705566,True,/backup/Intern/combine_skindiseaseclassifier_devraj/reports/gradcam/convnext_tiny/test/folliculitis__pred_folliculitis__devraj__selected_900plus_final__f3aab988.png
/backup/Intern/combine_skindiseaseclassifier_devraj/data/splits/test/folliculitis/devraj__selected_900plus_final__9a8873386561b9aa.jpg,folliculitis,folliculitis,0.9999330043792725,True,/backup/Intern/combine_skindiseaseclassifier_devraj/reports/gradcam/convnext_tiny/test/folliculitis__pred_folliculitis__devraj__selected_900plus_final__9a887338.png
/backup/Intern/combine_skindiseaseclassifier_devraj/data/splits/test/folliculitis/devraj__selected_900plus_final__111b2c1af3b94d1c.jpg,folliculitis,folliculitis,0.9967846870422363,True,/backup/Intern/combine_skindiseaseclassifier_devraj/reports/gradcam/convnext_tiny/test/folliculitis__pred_folliculitis__devraj__selected_900plus_final__111b2c1a.png
/backup/Intern/combine_skindiseaseclassifier_devraj/data/splits/test/fungal_nail_infections/dermassist__dermnet__adb25d2775459c05.jpg,fungal_nail_infections,fungal_nail_infections,0.9999548196792603,True,/backup/Intern/combine_skindiseaseclassifier_devraj/reports/gradcam/convnext_tiny/test/fungal_nail_infections__pred_fungal_nail_infections__dermassist__dermnet__adb25d2775459c05.png
/backup/Intern/combine_skindiseaseclassifier_devraj/data/splits/test/fungal_nail_infections/dermassist__dermnet__0feeb588dda7b090.jpg,fungal_nail_infections,fungal_nail_infections,0.9868682622909546,True,/backup/Intern/combine_skindiseaseclassifier_devraj/reports/gradcam/convnext_tiny/test/fungal_nail_infections__pred_fungal_nail_infections__dermassist__dermnet__0feeb588dda7b090.png
/backup/Intern/combine_skindiseaseclassifier_devraj/data/splits/test/fungal_nail_infections/dermassist__dermnet__a7520e925517900f.jpg,fungal_nail_infections,fungal_nail_infections,0.995492696762085,True,/backup/Intern/combine_skindiseaseclassifier_devraj/reports/gradcam/convnext_tiny/test/fungal_nail_infections__pred_fungal_nail_infections__dermassist__dermnet__a7520e925517900f.png
/backup/Intern/combine_skindiseaseclassifier_devraj/data/splits/test/lupus_related_skin_lesions/dermassist__dermnet__71bbd388ee7e8f37.jpg,lupus_related_skin_lesions,plaque_psoriasis,0.5857243537902832,False,/backup/Intern/combine_skindiseaseclassifier_devraj/reports/gradcam/convnext_tiny/test/lupus_related_skin_lesions__pred_plaque_psoriasis__dermassist__dermnet__71bbd388ee7e8f37.png
/backup/Intern/combine_skindiseaseclassifier_devraj/data/splits/test/lupus_related_skin_lesions/dermassist__dermnet__eba3467a8c8279f2.jpg,lupus_related_skin_lesions,drug_eruptions,0.4586881995201111,False,/backup/Intern/combine_skindiseaseclassifier_devraj/reports/gradcam/convnext_tiny/test/lupus_related_skin_lesions__pred_drug_eruptions__dermassist__dermnet__eba3467a8c8279f2.png
/backup/Intern/combine_skindiseaseclassifier_devraj/data/splits/test/lupus_related_skin_lesions/dermassist__dermnet__3f8e4940b2c0d6db.jpg,lupus_related_skin_lesions,lupus_related_skin_lesions,0.9917871356010437,True,/backup/Intern/combine_skindiseaseclassifier_devraj/reports/gradcam/convnext_tiny/test/lupus_related_skin_lesions__pred_lupus_related_skin_lesions__dermassist__dermnet__3f8e4940b2c0d6db.png
/backup/Intern/combine_skindiseaseclassifier_devraj/data/splits/test/melanoma/dermassist__skin_diseases_image__df25e305d495c437.jpg,melanoma,melanoma,0.9999945163726807,True,/backup/Intern/combine_skindiseaseclassifier_devraj/reports/gradcam/convnext_tiny/test/melanoma__pred_melanoma__dermassist__skin_diseases_image__df25e30.png
/backup/Intern/combine_skindiseaseclassifier_devraj/data/splits/test/melanoma/dermassist__siim_isic__4b2d9c2e36cb398b.jpg,melanoma,melanoma,0.9969770908355713,True,/backup/Intern/combine_skindiseaseclassifier_devraj/reports/gradcam/convnext_tiny/test/melanoma__pred_melanoma__dermassist__siim_isic__4b2d9c2e36cb398b.png
/backup/Intern/combine_skindiseaseclassifier_devraj/data/splits/test/melanoma/dermassist__bcn20000__be4a500c317672be.jpg,melanoma,melanoma,0.997633695602417,True,/backup/Intern/combine_skindiseaseclassifier_devraj/reports/gradcam/convnext_tiny/test/melanoma__pred_melanoma__dermassist__bcn20000__be4a500c317672be.png
/backup/Intern/combine_skindiseaseclassifier_devraj/data/splits/test/plaque_psoriasis/devraj__selected_900plus_final__52ca3e97507fde7f.jpeg,plaque_psoriasis,plaque_psoriasis,0.5538090467453003,True,/backup/Intern/combine_skindiseaseclassifier_devraj/reports/gradcam/convnext_tiny/test/plaque_psoriasis__pred_plaque_psoriasis__devraj__selected_900plus_final__52ca3e97.png
/backup/Intern/combine_skindiseaseclassifier_devraj/data/splits/test/plaque_psoriasis/dermassist__dermnet__59d3fdfed0a54454.jpg,plaque_psoriasis,plaque_psoriasis,0.6847967505455017,True,/backup/Intern/combine_skindiseaseclassifier_devraj/reports/gradcam/convnext_tiny/test/plaque_psoriasis__pred_plaque_psoriasis__dermassist__dermnet__59d3fdfed0a54454.png
/backup/Intern/combine_skindiseaseclassifier_devraj/data/splits/test/plaque_psoriasis/dermassist__dermnet__7bc754ce0b7135d2.jpg,plaque_psoriasis,tinea_corporis,0.4974122643470764,False,/backup/Intern/combine_skindiseaseclassifier_devraj/reports/gradcam/convnext_tiny/test/plaque_psoriasis__pred_tinea_corporis__dermassist__dermnet__7bc754ce0b7135d2.png
/backup/Intern/combine_skindiseaseclassifier_devraj/data/splits/test/seborrheic_dermatitis/devraj__selected_900plus_final__9e27577ef5ebbe94.jpg,seborrheic_dermatitis,seborrheic_dermatitis,0.9999977350234985,True,/backup/Intern/combine_skindiseaseclassifier_devraj/reports/gradcam/convnext_tiny/test/seborrheic_dermatitis__pred_seborrheic_dermatitis__devraj__selected_900plus_final__9e27577e.png
/backup/Intern/combine_skindiseaseclassifier_devraj/data/splits/test/seborrheic_dermatitis/devraj__selected_900plus_final__7210458d9b3eb8fc.jpg,seborrheic_dermatitis,seborrheic_dermatitis,0.9999990463256836,True,/backup/Intern/combine_skindiseaseclassifier_devraj/reports/gradcam/convnext_tiny/test/seborrheic_dermatitis__pred_seborrheic_dermatitis__devraj__selected_900plus_final__7210458d.png
/backup/Intern/combine_skindiseaseclassifier_devraj/data/splits/test/seborrheic_dermatitis/devraj__selected_900plus_final__44feea31f2a283d3.jpg,seborrheic_dermatitis,seborrheic_dermatitis,0.9999878406524658,True,/backup/Intern/combine_skindiseaseclassifier_devraj/reports/gradcam/convnext_tiny/test/seborrheic_dermatitis__pred_seborrheic_dermatitis__devraj__selected_900plus_final__44feea31.png
/backup/Intern/combine_skindiseaseclassifier_devraj/data/splits/test/tinea_corporis/dermassist__dermnet__2e0a4293355a299f.jpg,tinea_corporis,tinea_corporis,0.9856634140014648,True,/backup/Intern/combine_skindiseaseclassifier_devraj/reports/gradcam/convnext_tiny/test/tinea_corporis__pred_tinea_corporis__dermassist__dermnet__2e0a4293355a299f.png
/backup/Intern/combine_skindiseaseclassifier_devraj/data/splits/test/tinea_corporis/dermassist__dermnet__117d4786761a4bec.jpg,tinea_corporis,tinea_corporis,0.8217210173606873,True,/backup/Intern/combine_skindiseaseclassifier_devraj/reports/gradcam/convnext_tiny/test/tinea_corporis__pred_tinea_corporis__dermassist__dermnet__117d4786761a4bec.png
/backup/Intern/combine_skindiseaseclassifier_devraj/data/splits/test/tinea_corporis/dermassist__dermnet__05e17da04e7929ad.jpg,tinea_corporis,atopic_dermatitis,0.9978588223457336,False,/backup/Intern/combine_skindiseaseclassifier_devraj/reports/gradcam/convnext_tiny/test/tinea_corporis__pred_atopic_dermatitis__dermassist__dermnet__05e17da04e7929ad.png
/backup/Intern/combine_skindiseaseclassifier_devraj/data/splits/test/vitiligo/devraj__pacific_train__1b514d488cb1e636.jpeg,vitiligo,vitiligo,0.9999923706054688,True,/backup/Intern/combine_skindiseaseclassifier_devraj/reports/gradcam/convnext_tiny/test/vitiligo__pred_vitiligo__devraj__pacific_train__1b514d488cb1e636.png
/backup/Intern/combine_skindiseaseclassifier_devraj/data/splits/test/vitiligo/dermassist__dermnet__506da03cf088e34a.jpg,vitiligo,drug_eruptions,0.36192476749420166,False,/backup/Intern/combine_skindiseaseclassifier_devraj/reports/gradcam/convnext_tiny/test/vitiligo__pred_drug_eruptions__dermassist__dermnet__506da03cf088e34a.png
/backup/Intern/combine_skindiseaseclassifier_devraj/data/splits/test/vitiligo/dermassist__skin_diseases_kaggle__2e4ebf2eeeeb2feb.jpg,vitiligo,vitiligo,0.9991008043289185,True,/backup/Intern/combine_skindiseaseclassifier_devraj/reports/gradcam/convnext_tiny/test/vitiligo__pred_vitiligo__dermassist__skin_diseases_kaggle__2e4ebf.png
/backup/Intern/combine_skindiseaseclassifier_devraj/data/splits/test/warts/dermassist__dermnet__ddc6c04e5990fec8.jpg,warts,drug_eruptions,0.7743659019470215,False,/backup/Intern/combine_skindiseaseclassifier_devraj/reports/gradcam/convnext_tiny/test/warts__pred_drug_eruptions__dermassist__dermnet__ddc6c04e5990fec8.png
/backup/Intern/combine_skindiseaseclassifier_devraj/data/splits/test/warts/dermassist__dermnet__85f6cc01d6a47722.jpg,warts,warts,0.9991017580032349,True,/backup/Intern/combine_skindiseaseclassifier_devraj/reports/gradcam/convnext_tiny/test/warts__pred_warts__dermassist__dermnet__85f6cc01d6a47722.png
/backup/Intern/combine_skindiseaseclassifier_devraj/data/splits/test/warts/dermassist__dermnet__91e32ce148d43e1e.jpg,warts,warts,0.7458312511444092,True,/backup/Intern/combine_skindiseaseclassifier_devraj/reports/gradcam/convnext_tiny/test/warts__pred_warts__dermassist__dermnet__91e32ce148d43e1e.png

markdown_reports/gradcam_convnext_tiny_test_summary.md

### acne_vulgaris | predicted: acne_vulgaris | confidence: 100.00%

![Grad-CAM](../reports/gradcam/convnext_tiny/test/acne_vulgaris__pred_acne_vulgaris__dermassist__skin_diseases_kaggle__ec030c.png)
### acne_vulgaris | predicted: acne_vulgaris | confidence: 99.97%

![Grad-CAM](../reports/gradcam/convnext_tiny/test/acne_vulgaris__pred_acne_vulgaris__dermassist__skin_diseases_kaggle__fc624a.png)
### atopic_dermatitis | predicted: atopic_dermatitis | confidence: 79.65%

![Grad-CAM](../reports/gradcam/convnext_tiny/test/atopic_dermatitis__pred_atopic_dermatitis__devraj__selected_900plus_final__967cb48b.png)
### atopic_dermatitis | predicted: atopic_dermatitis | confidence: 95.16%

![Grad-CAM](../reports/gradcam/convnext_tiny/test/atopic_dermatitis__pred_atopic_dermatitis__devraj__selected_900plus_final__bdadc624.png)
### atopic_dermatitis | predicted: contact_dermatitis | confidence: 97.58%

![Grad-CAM](../reports/gradcam/convnext_tiny/test/atopic_dermatitis__pred_contact_dermatitis__dermassist__dermnet__3b47f68d5f6e0565.png)
### basal_cell_carcinoma | predicted: basal_cell_carcinoma | confidence: 87.26%

![Grad-CAM](../reports/gradcam/convnext_tiny/test/basal_cell_carcinoma__pred_basal_cell_carcinoma__dermassist__skin_diseases_image__9e96f2f.png)
### basal_cell_carcinoma | predicted: basal_cell_carcinoma | confidence: 99.59%

![Grad-CAM](../reports/gradcam/convnext_tiny/test/basal_cell_carcinoma__pred_basal_cell_carcinoma__dermassist__bcn20000__c09804e64bb7c226.png)
### basal_cell_carcinoma | predicted: basal_cell_carcinoma | confidence: 55.15%

![Grad-CAM](../reports/gradcam/convnext_tiny/test/contact_dermatitis__pred_contact_dermatitis__devraj__selected_900plus_final__fafabce6.png)
### contact_dermatitis | predicted: contact_dermatitis | confidence: 32.44%

![Grad-CAM](../reports/gradcam/convnext_tiny/test/contact_dermatitis__pred_contact_dermatitis__dermassist__dermnet__056f0739bbbaa961.png)
### contact_dermatitis | predicted: contact_dermatitis | confidence: 99.95%