reports/attention/vit_b_16/test/vit_attention_metadata.csv

image_path,true_label,pred_label,confidence,correct,attention_path
/backup/Intern/combine_skindiseaseclassifier_devraj/data/splits/test/acne_vulgaris/dermassist__skin_diseases_kaggle__ec030cccba880951.jpeg,acne_vulgaris,acne_vulgaris,0.5270376801490784,True,/backup/Intern/combine_skindiseaseclassifier_devraj/reports/attention/vit_b_16/test/acne_vulgaris__pred_acne_vulgaris__dermassist__skin_diseases_kaggle__ec030c.png
/backup/Intern/combine_skindiseaseclassifier_devraj/data/splits/test/acne_vulgaris/dermassist__skin_diseases_kaggle__c9c2ee82ba0a53cb.jpeg,acne_vulgaris,warts,0.3256781995296478,False,/backup/Intern/combine_skindiseaseclassifier_devraj/reports/attention/vit_b_16/test/acne_vulgaris__pred_warts__dermassist__skin_diseases_kaggle__c9c2ee.png
/backup/Intern/combine_skindiseaseclassifier_devraj/data/splits/test/acne_vulgaris/dermassist__skin_diseases_kaggle__fc624a0f74ea0221.jpeg,acne_vulgaris,acne_vulgaris,0.3036275804042816,True,/backup/Intern/combine_skindiseaseclassifier_devraj/reports/attention/vit_b_16/test/acne_vulgaris__pred_acne_vulgaris__dermassist__skin_diseases_kaggle__fc624a.png
/backup/Intern/combine_skindiseaseclassifier_devraj/data/splits/test/atopic_dermatitis/devraj__selected_900plus_final__967cb48b20a9c1ac.jpeg,atopic_dermatitis,atopic_dermatitis,0.6960756778717041,True,/backup/Intern/combine_skindiseaseclassifier_devraj/reports/attention/vit_b_16/test/atopic_dermatitis__pred_atopic_dermatitis__devraj__selected_900plus_final__967cb48b.png
/backup/Intern/combine_skindiseaseclassifier_devraj/data/splits/test/atopic_dermatitis/devraj__selected_900plus_final__bdadc624160d1d4d.jpeg,atopic_dermatitis,contact_dermatitis,0.33344289660453796,False,/backup/Intern/combine_skindiseaseclassifier_devraj/reports/attention/vit_b_16/test/atopic_dermatitis__pred_contact_dermatitis__devraj__selected_900plus_final__bdadc624.png
/backup/Intern/combine_skindiseaseclassifier_devraj/data/splits/test/atopic_dermatitis/dermassist__dermnet__3b47f68d5f6e0565.jpg,atopic_dermatitis,tinea_corporis,0.582490086555481,False,/backup/Intern/combine_skindiseaseclassifier_devraj/reports/attention/vit_b_16/test/atopic_dermatitis__pred_tinea_corporis__dermassist__dermnet__3b47f68d5f6e0565.png
/backup/Intern/combine_skindiseaseclassifier_devraj/data/splits/test/basal_cell_carcinoma/dermassist__skin_diseases_image__9e96f2f4b8216b29.jpg,basal_cell_carcinoma,melanoma,0.3092670142650604,False,/backup/Intern/combine_skindiseaseclassifier_devraj/reports/attention/vit_b_16/test/basal_cell_carcinoma__pred_melanoma__dermassist__skin_diseases_image__9e96f2f.png
/backup/Intern/combine_skindiseaseclassifier_devraj/data/splits/test/basal_cell_carcinoma/dermassist__bcn20000__c09804e64bb7c226.jpg,basal_cell_carcinoma,basal_cell_carcinoma,0.6244939565658569,True,/backup/Intern/combine_skindiseaseclassifier_devraj/reports/attention/vit_b_16/test/basal_cell_carcinoma__pred_basal_cell_carcinoma__dermassist__bcn20000__c09804e64bb7c226.png
/backup/Intern/combine_skindiseaseclassifier_devraj/data/splits/test/basal_cell_carcinoma/dermassist__skin_diseases_image__eb7f6d2e6f4e0ba9.jpg,basal_cell_carcinoma,melanoma,0.5185831189155579,False,/backup/Intern/combine_skindiseaseclassifier_devraj/reports/attention/vit_b_16/test/basal_cell_carcinoma__pred_melanoma__dermassist__skin_diseases_image__eb7f6d2.png
/backup/Intern/combine_skindiseaseclassifier_devraj/data/splits/test/contact_dermatitis/devraj__selected_900plus_final__fafabce6e0e3e8c0.jpg,contact_dermatitis,contact_dermatitis,0.79928058385849,True,/backup/Intern/combine_skindiseaseclassifier_devraj/reports/attention/vit_b_16/test/contact_dermatitis__pred_contact_dermatitis__devraj__selected_900plus_final__fafabce6.png
/backup/Intern/combine_skindiseaseclassifier_devraj/data/splits/test/contact_dermatitis/dermassist__dermnet__056f0739bbbaa961.jpg,contact_dermatitis,lupus_related_skin_lesions,0.3844812214374542,False,/backup/Intern/combine_skindiseaseclassifier_devraj/reports/attention/vit_b_16/test/contact_dermatitis__pred_lupus_related_skin_lesions__dermassist__dermnet__056f0739bbbaa961.png
/backup/Intern/combine_skindiseaseclassifier_devraj/data/splits/test/contact_dermatitis/devraj__selected_900plus_final__0c823388aa7aa0bb.jpg,contact_dermatitis,contact_dermatitis,0.7290176749229431,True,/backup/Intern/combine_skindiseaseclassifier_devraj/reports/attention/vit_b_16/test/contact_dermatitis__pred_contact_dermatitis__devraj__selected_900plus_final__0c823388.png
/backup/Intern/combine_skindiseaseclassifier_devraj/data/splits/test/drug_eruptions/dermassist__dermnet__eb8314833cb08557.jpg,drug_eruptions,tinea_corporis,0.5288786292076111,False,/backup/Intern/combine_skindiseaseclassifier_devraj/reports/attention/vit_b_16/test/drug_eruptions__pred_tinea_corporis__dermassist__dermnet__eb8314833cb08557.png
/backup/Intern/combine_skindiseaseclassifier_devraj/data/splits/test/drug_eruptions/devraj__pacific_train__03f747588976a11c.jpeg,drug_eruptions,melanoma,0.5397207736968994,False,/backup/Intern/combine_skindiseaseclassifier_devraj/reports/attention/vit_b_16/test/drug_eruptions__pred_melanoma__devraj__pacific_train__03f747588976a11c.png
/backup/Intern/combine_skindiseaseclassifier_devraj/data/splits/test/drug_eruptions/devraj__pacific_test__5aff42a4730e1fe3.jpeg,drug_eruptions,drug_eruptions,0.7756882309913635,True,/backup/Intern/combine_skindiseaseclassifier_devraj/reports/attention/vit_b_16/test/drug_eruptions__pred_drug_eruptions__devraj__pacific_test__5aff42a4730e1fe3.png
/backup/Intern/combine_skindiseaseclassifier_devraj/data/splits/test/folliculitis/devraj__selected_900plus_final__f3aab988bed1d2c2.jpg,folliculitis,vitiligo,0.24918539822101593,False,/backup/Intern/combine_skindiseaseclassifier_devraj/reports/attention/vit_b_16/test/folliculitis__pred_vitiligo__devraj__selected_900plus_final__f3aab988.png
/backup/Intern/combine_skindiseaseclassifier_devraj/data/splits/test/folliculitis/devraj__selected_900plus_final__9a8873386561b9aa.jpg,folliculitis,atopic_dermatitis,0.21644794940948486,False,/backup/Intern/combine_skindiseaseclassifier_devraj/reports/attention/vit_b_16/test/folliculitis__pred_atopic_dermatitis__devraj__selected_900plus_final__9a887338.png
/backup/Intern/combine_skindiseaseclassifier_devraj/data/splits/test/folliculitis/devraj__selected_900plus_final__111b2c1af3b94d1c.jpg,folliculitis,folliculitis,0.35115158557891846,True,/backup/Intern/combine_skindiseaseclassifier_devraj/reports/attention/vit_b_16/test/folliculitis__pred_folliculitis__devraj__selected_900plus_final__111b2c1a.png
/backup/Intern/combine_skindiseaseclassifier_devraj/data/splits/test/fungal_nail_infections/dermassist__dermnet__adb25d2775459c05.jpg,fungal_nail_infections,tinea_corporis,0.7093768119812012,False,/backup/Intern/combine_skindiseaseclassifier_devraj/reports/attention/vit_b_16/test/fungal_nail_infections__pred_tinea_corporis__dermassist__dermnet__adb25d2775459c05.png
/backup/Intern/combine_skindiseaseclassifier_devraj/data/splits/test/fungal_nail_infections/dermassist__dermnet__0feeb588dda7b090.jpg,fungal_nail_infections,contact_dermatitis,0.32499754428863525,False,/backup/Intern/combine_skindiseaseclassifier_devraj/reports/attention/vit_b_16/test/fungal_nail_infections__pred_contact_dermatitis__dermassist__dermnet__0feeb588dda7b090.png
/backup/Intern/combine_skindiseaseclassifier_devraj/data/splits/test/fungal_nail_infections/dermassist__dermnet__a7520e925517900f.jpg,fungal_nail_infections,contact_dermatitis,0.6488507986068726,False,/backup/Intern/combine_skindiseaseclassifier_devraj/reports/attention/vit_b_16/test/fungal_nail_infections__pred_contact_dermatitis__dermassist__dermnet__a7520e925517900f.png
/backup/Intern/combine_skindiseaseclassifier_devraj/data/splits/test/lupus_related_skin_lesions/dermassist__dermnet__71bbd388ee7e8f37.jpg,lupus_related_skin_lesions,plaque_psoriasis,0.564393937587738,False,/backup/Intern/combine_skindiseaseclassifier_devraj/reports/attention/vit_b_16/test/lupus_related_skin_lesions__pred_plaque_psoriasis__dermassist__dermnet__71bbd388ee7e8f37.png
/backup/Intern/combine_skindiseaseclassifier_devraj/data/splits/test/lupus_related_skin_lesions/dermassist__dermnet__eba3467a8c8279f2.jpg,lupus_related_skin_lesions,tinea_corporis,0.2973529100418091,False,/backup/Intern/combine_skindiseaseclassifier_devraj/reports/attention/vit_b_16/test/lupus_related_skin_lesions__pred_tinea_corporis__dermassist__dermnet__eba3467a8c8279f2.png
/backup/Intern/combine_skindiseaseclassifier_devraj/data/splits/test/lupus_related_skin_lesions/dermassist__dermnet__3f8e4940b2c0d6db.jpg,lupus_related_skin_lesions,plaque_psoriasis,0.42787253856658936,False,/backup/Intern/combine_skindiseaseclassifier_devraj/reports/attention/vit_b_16/test/lupus_related_skin_lesions__pred_plaque_psoriasis__dermassist__dermnet__3f8e4940b2c0d6db.png
/backup/Intern/combine_skindiseaseclassifier_devraj/data/splits/test/melanoma/dermassist__skin_diseases_image__df25e305d495c437.jpg,melanoma,melanoma,0.9021552205085754,True,/backup/Intern/combine_skindiseaseclassifier_devraj/reports/attention/vit_b_16/test/melanoma__pred_melanoma__dermassist__skin_diseases_image__df25e30.png
/backup/Intern/combine_skindiseaseclassifier_devraj/data/splits/test/melanoma/dermassist__siim_isic__4b2d9c2e36cb398b.jpg,melanoma,melanoma,0.8879174590110779,True,/backup/Intern/combine_skindiseaseclassifier_devraj/reports/attention/vit_b_16/test/melanoma__pred_melanoma__dermassist__siim_isic__4b2d9c2e36cb398b.png
/backup/Intern/combine_skindiseaseclassifier_devraj/data/splits/test/melanoma/dermassist__bcn20000__be4a500c317672be.jpg,melanoma,melanoma,0.9278662800788879,True,/backup/Intern/combine_skindiseaseclassifier_devraj/reports/attention/vit_b_16/test/melanoma__pred_melanoma__dermassist__bcn20000__be4a500c317672be.png
/backup/Intern/combine_skindiseaseclassifier_devraj/data/splits/test/plaque_psoriasis/devraj__selected_900plus_final__52ca3e97507fde7f.jpeg,plaque_psoriasis,plaque_psoriasis,0.22413957118988037,True,/backup/Intern/combine_skindiseaseclassifier_devraj/reports/attention/vit_b_16/test/plaque_psoriasis__pred_plaque_psoriasis__devraj__selected_900plus_final__52ca3e97.png
/backup/Intern/combine_skindiseaseclassifier_devraj/data/splits/test/plaque_psoriasis/dermassist__dermnet__59d3fdfed0a54454.jpg,plaque_psoriasis,drug_eruptions,0.3451443612575531,False,/backup/Intern/combine_skindiseaseclassifier_devraj/reports/attention/vit_b_16/test/plaque_psoriasis__pred_drug_eruptions__dermassist__dermnet__59d3fdfed0a54454.png
/backup/Intern/combine_skindiseaseclassifier_devraj/data/splits/test/plaque_psoriasis/dermassist__dermnet__7bc754ce0b7135d2.jpg,plaque_psoriasis,plaque_psoriasis,0.831324577331543,True,/backup/Intern/combine_skindiseaseclassifier_devraj/reports/attention/vit_b_16/test/plaque_psoriasis__pred_plaque_psoriasis__dermassist__dermnet__7bc754ce0b7135d2.png
/backup/Intern/combine_skindiseaseclassifier_devraj/data/splits/test/seborrheic_dermatitis/devraj__selected_900plus_final__9e27577ef5ebbe94.jpg,seborrheic_dermatitis,seborrheic_dermatitis,0.7278228998184204,True,/backup/Intern/combine_skindiseaseclassifier_devraj/reports/attention/vit_b_16/test/seborrheic_dermatitis__pred_seborrheic_dermatitis__devraj__selected_900plus_final__9e27577e.png
/backup/Intern/combine_skindiseaseclassifier_devraj/data/splits/test/seborrheic_dermatitis/devraj__selected_900plus_final__7210458d9b3eb8fc.jpg,seborrheic_dermatitis,seborrheic_dermatitis,0.3122207522392273,True,/backup/Intern/combine_skindiseaseclassifier_devraj/reports/attention/vit_b_16/test/seborrheic_dermatitis__pred_seborrheic_dermatitis__devraj__selected_900plus_final__7210458d.png
/backup/Intern/combine_skindiseaseclassifier_devraj/data/splits/test/seborrheic_dermatitis/devraj__selected_900plus_final__44feea31f2a283d3.jpg,seborrheic_dermatitis,seborrheic_dermatitis,0.46921342611312866,True,/backup/Intern/combine_skindiseaseclassifier_devraj/reports/attention/vit_b_16/test/seborrheic_dermatitis__pred_seborrheic_dermatitis__devraj__selected_900plus_final__44feea31.png
/backup/Intern/combine_skindiseaseclassifier_devraj/data/splits/test/tinea_corporis/dermassist__dermnet__2e0a4293355a299f.jpg,tinea_corporis,drug_eruptions,0.41615596413612366,False,/backup/Intern/combine_skindiseaseclassifier_devraj/reports/attention/vit_b_16/test/tinea_corporis__pred_drug_eruptions__dermassist__dermnet__2e0a4293355a299f.png
/backup/Intern/combine_skindiseaseclassifier_devraj/data/splits/test/tinea_corporis/dermassist__dermnet__117d4786761a4bec.jpg,tinea_corporis,tinea_corporis,0.45759886503219604,True,/backup/Intern/combine_skindiseaseclassifier_devraj/reports/attention/vit_b_16/test/tinea_corporis__pred_tinea_corporis__dermassist__dermnet__117d4786761a4bec.png
/backup/Intern/combine_skindiseaseclassifier_devraj/data/splits/test/tinea_corporis/dermassist__dermnet__05e17da04e7929ad.jpg,tinea_corporis,warts,0.333124041557312,False,/backup/Intern/combine_skindiseaseclassifier_devraj/reports/attention/vit_b_16/test/tinea_corporis__pred_warts__dermassist__dermnet__05e17da04e7929ad.png
/backup/Intern/combine_skindiseaseclassifier_devraj/data/splits/test/vitiligo/devraj__pacific_train__1b514d488cb1e636.jpeg,vitiligo,vitiligo,0.9806217551231384,True,/backup/Intern/combine_skindiseaseclassifier_devraj/reports/attention/vit_b_16/test/vitiligo__pred_vitiligo__devraj__pacific_train__1b514d488cb1e636.png
/backup/Intern/combine_skindiseaseclassifier_devraj/data/splits/test/vitiligo/dermassist__dermnet__506da03cf088e34a.jpg,vitiligo,plaque_psoriasis,0.6804636120796204,False,/backup/Intern/combine_skindiseaseclassifier_devraj/reports/attention/vit_b_16/test/vitiligo__pred_plaque_psoriasis__dermassist__dermnet__506da03cf088e34a.png
/backup/Intern/combine_skindiseaseclassifier_devraj/data/splits/test/vitiligo/dermassist__skin_diseases_kaggle__2e4ebf2eeeeb2feb.jpg,vitiligo,vitiligo,0.8560786843299866,True,/backup/Intern/combine_skindiseaseclassifier_devraj/reports/attention/vit_b_16/test/vitiligo__pred_vitiligo__dermassist__skin_diseases_kaggle__2e4ebf.png
/backup/Intern/combine_skindiseaseclassifier_devraj/data/splits/test/warts/dermassist__dermnet__ddc6c04e5990fec8.jpg,warts,warts,0.5703784823417664,True,/backup/Intern/combine_skindiseaseclassifier_devraj/reports/attention/vit_b_16/test/warts__pred_warts__dermassist__dermnet__ddc6c04e5990fec8.png
/backup/Intern/combine_skindiseaseclassifier_devraj/data/splits/test/warts/dermassist__dermnet__85f6cc01d6a47722.jpg,warts,warts,0.8139626383781433,True,/backup/Intern/combine_skindiseaseclassifier_devraj/reports/attention/vit_b_16/test/warts__pred_warts__dermassist__dermnet__85f6cc01d6a47722.png
/backup/Intern/combine_skindiseaseclassifier_devraj/data/splits/test/warts/dermassist__dermnet__91e32ce148d43e1e.jpg,warts,atopic_dermatitis,0.20024210214614868,False,/backup/Intern/combine_skindiseaseclassifier_devraj/reports/attention/vit_b_16/test/warts__pred_atopic_dermatitis__dermassist__dermnet__91e32ce148d43e1e.png

markdown_reports/vit_attention_test_summary.md

### acne_vulgaris | predicted: acne_vulgaris | confidence: 52.70%

![ViT attention](../reports/attention/vit_b_16/test/acne_vulgaris__pred_acne_vulgaris__dermassist__skin_diseases_kaggle__ec030c.png)
### acne_vulgaris | predicted: warts | confidence: 32.57%

![ViT attention](../reports/attention/vit_b_16/test/acne_vulgaris__pred_warts__dermassist__skin_diseases_kaggle__c9c2ee.png)
### acne_vulgaris | predicted: acne_vulgaris | confidence: 30.36%

![ViT attention](../reports/attention/vit_b_16/test/acne_vulgaris__pred_acne_vulgaris__dermassist__skin_diseases_kaggle__fc624a.png)
### atopic_dermatitis | predicted: atopic_dermatitis | confidence: 69.61%

![ViT attention](../reports/attention/vit_b_16/test/atopic_dermatitis__pred_atopic_dermatitis__devraj__selected_900plus_final__967cb48b.png)
### atopic_dermatitis | predicted: contact_dermatitis | confidence: 33.34%

![ViT attention](../reports/attention/vit_b_16/test/atopic_dermatitis__pred_contact_dermatitis__devraj__selected_900plus_final__bdadc624.png)
### atopic_dermatitis | predicted: tinea_corporis | confidence: 58.25%

![ViT attention](../reports/attention/vit_b_16/test/atopic_dermatitis__pred_tinea_corporis__dermassist__dermnet__3b47f68d5f6e0565.png)
### basal_cell_carcinoma | predicted: melanoma | confidence: 30.93%

![ViT attention](../reports/attention/vit_b_16/test/basal_cell_carcinoma__pred_melanoma__dermassist__skin_diseases_image__9e96f2f.png)
### basal_cell_carcinoma | predicted: basal_cell_carcinoma | confidence: 62.45%

![ViT attention](../reports/attention/vit_b_16/test/basal_cell_carcinoma__pred_basal_cell_carcinoma__dermassist__bcn20000__c09804e64bb7c226.png)
### basal_cell_carcinoma | predicted: melanoma | confidence: 51.86%

![ViT attention](../reports/attention/vit_b_16/test/basal_cell_carcinoma__pred_melanoma__dermassist__skin_diseases_image__eb7f6d2.png)
### contact_dermatitis | predicted: contact_dermatitis | confidence: 79.93%

![ViT attention](../reports/attention/vit_b_16/test/contact_dermatitis__pred_contact_dermatitis__devraj__selected_900plus_final__fafabce6.png)
### contact_dermatitis | predicted: lupus_related_skin_lesions | confidence: 38.45%

![ViT attention](../reports/attention/vit_b_16/test/contact_dermatitis__pred_lupus_related_skin_lesions__dermassist__dermnet__056f0739bbbaa961.png)
### contact_dermatitis | predicted: contact_dermatitis | confidence: 72.90%